{
  "schema_version": "azure-provenance-artifact/v1",
  "attested_at": "2026-04-21",
  "attested_by": "example-maintainer",
  "artifact": {
    "uri": "https://dev.azure.com/example-org/_apis/build/builds/12345/artifacts?artifactName=drop&api-version=7.1",
    "digest_sha256": "217222989e29453ef32583793351191ae6c50778a4bf072072a4a730c7fefdc4"
  },
  "attestation": {
    "kind": "cosign",
    "digest_sha256": "a6d0499c2cdb2d85a41f2f17bbf98075146ddd14e020c0d68c3cd0d32c126609"
  },
  "posture": {
    "attestation_covers_release_artifact": true,
    "attestation_digest_recorded": true,
    "artifact_digest_recorded": true
  },
  "verification": {
    "method": "cosign-verify-bundle",
    "verified_at": "2026-05-01T12:00:00Z",
    "transparency_log_inclusion": true,
    "issuer": "https://vstoken.dev.azure.com/example-org",
    "subject_alternative_name": "synthetic-fixture://example/repo:ref:refs/heads/master",
    "bundle_digest": "c8e9d2f1a4b7c0d3e6f9a2b5c8d1e4f7a0b3c6d9e2f5a8b1c4d7e0f3a6b9c2d5",
    "tool_version": "cosign 2.4.0"
  },
  "notes": "Synthetic Azure DevOps provenance attestation record for fixture evaluation."
}
